new_product_id,proposed_style_code,intended_like_cluster,brand,title,category,subcategory,gender,season,fit,color,material,price_tier,price_usd,feature_1,feature_2,core_term_1,core_term_2,core_term_3,description,analog_constraint_hints
NP101,RUN_NEUTRAL-NEW-01,RUN_NEUTRAL,Fieldline,Fieldline Performance Neutral Road Running Shoe - Navy,Footwear,Running Shoes,Men,All-Season,Athletic,Navy,Recycled Mesh,Mid,75.0,Cushioned collar,Ortholite insole,neutral cushioning,responsive midsole,heel-to-toe transition,"Fieldline Performance Neutral Road Running Shoe - Navy pairs a athletic fit with recycled mesh for all season wear. Designed for running shoes, it features cushioned collar and ortholite insole for dependable performance. Expect neutral cushioning, responsive midsole, and heel-to-toe transition in a versatile navy colorway. Ideal for daily miles, tempo efforts, and recovery jogs. Fit notes: secure lockdown with responsive feel. Grippy outsole and easy on/off details support everyday use.",category=Footwear; subcategory=Running Shoes; season=All-Season; price_tier~Mid; gender~Men
NP102,HIK_WATERPROOF-NEW-02,HIK_WATERPROOF,UrbanPeak,UrbanPeak Trail Waterproof Hiking Boot - Burgundy,Footwear,Hiking Boots,Men,FW,Regular,Burgundy,Nubuck,Mid,86.61,Gusseted tongue,Rock plate,waterproof membrane,durable toe cap,ankle support,"UrbanPeak Trail Waterproof Hiking Boot - Burgundy pairs a regular fit with nubuck for fw wear. Designed for hiking boots, it features gusseted tongue and rock plate for dependable performance. Expect waterproof membrane, durable toe cap, and ankle support in a versatile burgundy colorway. Ideal for muddy switchbacks, rocky scrambles, and long day hikes. Fit notes: true to size; layer comfortably underneath. Grippy outsole and easy on/off details support everyday use.",category=Footwear; subcategory=Hiking Boots; season=FW; price_tier~Mid; gender~Men
NP103,LEG_HI_RISE-NEW-03,LEG_HI_RISE,Trail&Town,Trail&Town Essential High-Rise Yoga Legging - Olive,Apparel,Leggings,Women,SS,Slim,Olive,Nylon,Mid,109.23,4-way stretch,Hidden pocket,buttery-soft,no front seam,opaque coverage,"Trail&Town Essential High-Rise Yoga Legging - Olive pairs a slim fit with nylon for ss wear. Designed for leggings, it features 4-way stretch and hidden pocket for dependable performance. Expect buttery-soft, no front seam, and opaque coverage in a versatile olive colorway. Ideal for studio flows, strength sessions, and errands. Fit notes: fits close to body; size up for a relaxed feel. Clean lines and minimal branding keep it versatile.",category=Apparel; subcategory=Leggings; season=SS; price_tier~Mid; gender~Women
NP104,JKT_RAIN-NEW-04,JKT_RAIN,UrbanPeak,UrbanPeak Studio 2.5L Rain Jacket - Teal,Apparel,Rain Jackets,Unisex,SS,Regular,Teal,Recycled Polyester,Mid,75.7,Breathable panels,Water-repellent,fully seam-sealed,PFC-free DWR,storm flap,"UrbanPeak Studio 2.5L Rain Jacket - Teal pairs a regular fit with recycled polyester for ss wear. Designed for rain jackets, it features breathable panels and water-repellent for dependable performance. Expect fully seam-sealed, PFC-free DWR, and storm flap in a versatile teal colorway. Ideal for unpredictable showers and breezy days. Fit notes: true to size; layer comfortably underneath. Clean lines and minimal branding keep it versatile.",category=Apparel; subcategory=Rain Jackets; season=SS; price_tier~Mid; gender~Unisex
NP105,SDL_CUSH-NEW-05,SDL_CUSH,EverNorth,EverNorth Everyday Cushioned Slide Sandal - Cobalt,Footwear,Sandals,Men,SS,Regular,Cobalt,EVA,Premium,212.95,Quick-dry,Textured strap lining,contoured footbed,pool-friendly,cloud-like cushioning,"EverNorth Everyday Cushioned Slide Sandal - Cobalt pairs a regular fit with eva for ss wear. Designed for sandals, it features quick-dry and textured strap lining for dependable performance. Expect contoured footbed, pool-friendly, and cloud-like cushioning in a versatile cobalt colorway. Ideal for pool days and post-workout recovery. Fit notes: true to size; layer comfortably underneath. Grippy outsole and easy on/off details support everyday use.",category=Footwear; subcategory=Sandals; season=SS; price_tier~Premium; gender~Men
